<?xml version="1.0" encoding="UTF-8"?>
<!DOCTYPE ticket SYSTEM "t3p3_GomezR_Daw.dtd" [
    <!ENTITY G "entity-value">
]>
<ticket cod="t00037">
    <datosTicket>
        <fecha>
            <dia>22</dia>
            <mes>12</mes>
            <ano>2018</ano>
        </fecha>
        <hora>12:23:12</hora>
        <precioTotal moneda="Euro">
            <precioSinIva>10,5</precioSinIva>
            <pvp iva= "&G;">12,75</pvp>
        </precioTotal>
        <formaPago tipo="Tarjeta">
            <tarjeta tipo="Visa">
                <numero>************1474</numero>
                <cliente>Aniceto Cartapeto</cliente>
            </tarjeta>
        </formaPago>
        <imgticket nombre="ticket12" formato="jpg" />
    </datosTicket>
    <datosComercio>
        <nombre>El Rincon</nombre>
        <dir>C/ Santander NÂº12</dir>
        <cif>989889A</cif>
        <telf>976121212</telf>
    </datosComercio>
    <datosCompra>
        <lineaCompra>
            <nombre>Barra Pan</nombre>
            <cantidad>10</cantidad>
            <precio iva= "&G;">1</precio>
            <pvpLinea>12,1</pvpLinea>
        </lineaCompra>
        <lineaCompra>
            <nombre>Palmera</nombre>
            <cantidad>1</cantidad>
            <precio iva= "&G;">0.5</precio>
            <pvpLinea>0.65</pvpLinea>
        </lineaCompra>
    </datosCompra>
</ticket>